{
  "schema_version": 1,
  "state_version": "sha256:0",
  "created_at": "2026-09-15T15:31:58Z",
  "updated_at": "2026-09-15T15:31:58Z",
  "runs": [],
  "sources": [],
  "snapshots": [],
  "providers": [],
  "models": [],
  "offers": [],
  "claims": [],
  "reviews": [],
  "changes": [],
  "collection_meta": {
    "last_successful_collection_at": null,
    "last_complete_collection_at": null,
    "initial_import_done": false,
    "retention_days": 90,
    "null_result_streaks": {}
  }
}
